result/vstar_pure_soft_correct_wrong_summary.json

{
  "total_samples": 50,
  "correct": {
    "count": 29,
    "mean_raw_conf": 0.758066682620878,
    "last10_raw_conf": 0.9092066271551724,
    "last20_raw_conf": 0.8772898706896551,
    "mean_raw_entropy": 0.848689500449811,
    "output_tokens": 128.68965517241378,
    "latency_sec": 5.64297262553511
  },
  "wrong": {
    "count": 21,
    "mean_raw_conf": 0.8055690276979268,
    "last10_raw_conf": 0.9453962053571429,
    "last20_raw_conf": 0.9057814825148809,
    "mean_raw_entropy": 0.7237537688424485,
    "output_tokens": 366.6666666666667,
    "latency_sec": 13.312212387720743
  },
  "topk_wrong_rate": {
    "mean_raw_conf_top5": 0.8,
    "last10_raw_conf_top5": 0.8,
    "last20_raw_conf_top5": 0.8
  },
  "sample_rows": [
    {
      "id": 0,
      "is_correct": true,
      "pred": "A",
      "gold": "A",
      "mean_raw_conf": 0.6970621744791666,
      "last10_raw_conf": 0.94140625,
      "last20_raw_conf": 0.8943359375,
      "mean_raw_entropy": 1.0311175370810641,
      "output_tokens": 335,
      "latency_sec": 12.709471464157104
    },
    {
      "id": 1,
      "is_correct": true,
      "pred": "C",
      "gold": "C",
      "mean_raw_conf": 0.738702182112069,
      "last10_raw_conf": 0.932421875,
      "last20_raw_conf": 0.938671875,
      "mean_raw_entropy": 0.9891536126619783,
      "output_tokens": 57,
      "latency_sec": 3.1783769130706787
    },
    {
      "id": 2,
      "is_correct": true,
      "pred": "A",
      "gold": "A",
      "mean_raw_conf": 0.6471036585365854,
      "last10_raw_conf": 0.949609375,
      "last20_raw_conf": 0.85537109375,
      "mean_raw_entropy": 1.3772395490933724,
      "output_tokens": 245,
      "latency_sec": 9.542320251464844
    },
    {
      "id": 3,
      "is_correct": true,
      "pred": "B",
      "gold": "B",
      "mean_raw_conf": 0.7963222287735849,
      "last10_raw_conf": 0.86484375,
      "last20_raw_conf": 0.8662109375,
      "mean_raw_entropy": 0.6896168910107523,
      "output_tokens": 52,
      "latency_sec": 3.1708924770355225
    },
    {
      "id": 4,
      "is_correct": false,
      "pred": "A",
      "gold": "C",
      "mean_raw_conf": 0.6343635110294118,
      "last10_raw_conf": 0.91328125,
      "last20_raw_conf": 0.7869140625,
      "mean_raw_entropy": 1.360332546865239,
      "output_tokens": 101,
      "latency_sec": 4.7940332889556885
    },
    {
      "id": 5,
      "is_correct": false,
      "pred": null,
      "gold": "D",
      "mean_raw_conf": 0.8351302083333333,
      "last10_raw_conf": 0.931640625,
      "last20_raw_conf": 0.959765625,
      "mean_raw_entropy": 0.5025091451406479,
      "output_tokens": 73,
      "latency_sec": 3.8468379974365234
    },
    {
      "id": 6,
      "is_correct": true,
      "pred": "B",
      "gold": "B",
      "mean_raw_conf": 0.8021065848214286,
      "last10_raw_conf": 0.903515625,
      "last20_raw_conf": 0.9447265625,
      "mean_raw_entropy": 0.712664856366357,
      "output_tokens": 97,
      "latency_sec": 4.30279541015625
    },
    {
      "id": 7,
      "is_correct": false,
      "pred": "C",
      "gold": "A",
      "mean_raw_conf": 0.7769463900862069,
      "last10_raw_conf": 0.937890625,
      "last20_raw_conf": 0.9234375,
      "mean_raw_entropy": 0.6972660802561661,
      "output_tokens": 143,
      "latency_sec": 6.05004096031189
    },
    {
      "id": 8,
      "is_correct": true,
      "pred": "B",
      "gold": "B",
      "mean_raw_conf": 0.6563695790816326,
      "last10_raw_conf": 0.8126953125,
      "last20_raw_conf": 0.680224609375,
      "mean_raw_entropy": 1.2526943026756754,
      "output_tokens": 48,
      "latency_sec": 3.0754990577697754
    },
    {
      "id": 9,
      "is_correct": false,
      "pred": "B",
      "gold": "D",
      "mean_raw_conf": 0.6811814466059603,
      "last10_raw_conf": 0.884375,
      "last20_raw_conf": 0.7720703125,
      "mean_raw_entropy": 1.1654546781880966,
      "output_tokens": 150,
      "latency_sec": 6.178020715713501
    },
    {
      "id": 10,
      "is_correct": true,
      "pred": "C",
      "gold": "C",
      "mean_raw_conf": 0.7997779323630136,
      "last10_raw_conf": 0.8953125,
      "last20_raw_conf": 0.943359375,
      "mean_raw_entropy": 0.6893106764310026,
      "output_tokens": 72,
      "latency_sec": 3.571471691131592
    },
    {
      "id": 11,
      "is_correct": false,
      "pred": null,
      "gold": "B",
      "mean_raw_conf": 0.7821214893196202,
      "last10_raw_conf": 0.923828125,
      "last20_raw_conf": 0.917578125,
      "mean_raw_entropy": 0.7773376348652418,
      "output_tokens": 77,
      "latency_sec": 3.6961004734039307
    },
    {
      "id": 12,
      "is_correct": true,
      "pred": "C",
      "gold": "C",
      "mean_raw_conf": 0.642578125,
      "last10_raw_conf": 0.880078125,
      "last20_raw_conf": 0.74013671875,
      "mean_raw_entropy": 1.2186008492304432,
      "output_tokens": 61,
      "latency_sec": 3.3445467948913574
    },
    {
      "id": 13,
      "is_correct": true,
      "pred": "A",
      "gold": "A",
      "mean_raw_conf": 0.7982077205882353,
      "last10_raw_conf": 0.95078125,
      "last20_raw_conf": 0.9470703125,
      "mean_raw_entropy": 0.6857234010801596,
      "output_tokens": 84,
      "latency_sec": 4.0633533000946045
    },
    {
      "id": 14,
      "is_correct": false,
      "pred": null,
      "gold": "B",
      "mean_raw_conf": 0.7676048801369864,
      "last10_raw_conf": 0.9083984375,
      "last20_raw_conf": 0.85390625,
      "mean_raw_entropy": 0.8098370572679663,
      "output_tokens": 71,
      "latency_sec": 3.7252254486083984
    },
    {
      "id": 15,
      "is_correct": true,
      "pred": "D",
      "gold": "D",
      "mean_raw_conf": 0.7710790094339622,
      "last10_raw_conf": 0.883984375,
      "last20_raw_conf": 0.8759765625,
      "mean_raw_entropy": 0.767912505370266,
      "output_tokens": 51,
      "latency_sec": 3.068655490875244
    },
    {
      "id": 16,
      "is_correct": true,
      "pred": "B",
      "gold": "B",
      "mean_raw_conf": 0.8097696109693877,
      "last10_raw_conf": 0.900390625,
      "last20_raw_conf": 0.931640625,
      "mean_raw_entropy": 0.6477052383885091,
      "output_tokens": 48,
      "latency_sec": 2.757455348968506
    },
    {
      "id": 17,
      "is_correct": false,
      "pred": null,
      "gold": "D",
      "mean_raw_conf": 0.7863892834595959,
      "last10_raw_conf": 0.94140625,
      "last20_raw_conf": 0.8845703125,
      "mean_raw_entropy": 0.7836733476230593,
      "output_tokens": 97,
      "latency_sec": 4.506403684616089
    },
    {
      "id": 18,
      "is_correct": false,
      "pred": "D",
      "gold": "C",
      "mean_raw_conf": 0.6789359047774869,
      "last10_raw_conf": 0.908203125,
      "last20_raw_conf": 0.83271484375,
      "mean_raw_entropy": 1.3716831485404395,
      "output_tokens": 190,
      "latency_sec": 7.3673906326293945
    },
    {
      "id": 19,
      "is_correct": false,
      "pred": null,
      "gold": "A",
      "mean_raw_conf": 0.9224178791046143,
      "last10_raw_conf": 1.0,
      "last20_raw_conf": 1.0,
      "mean_raw_entropy": 0.42389992068638094,
      "output_tokens": 1020,
      "latency_sec": 34.13973426818848
    },
    {
      "id": 20,
      "is_correct": true,
      "pred": "C",
      "gold": "C",
      "mean_raw_conf": 0.7154181985294118,
      "last10_raw_conf": 0.8724609375,
      "last20_raw_conf": 0.86591796875,
      "mean_raw_entropy": 1.056202748826906,
      "output_tokens": 50,
      "latency_sec": 2.9995758533477783
    },
    {
      "id": 21,
      "is_correct": true,
      "pred": "A",
      "gold": "A",
      "mean_raw_conf": 0.7276671362704918,
      "last10_raw_conf": 0.8966796875,
      "last20_raw_conf": 0.87490234375,
      "mean_raw_entropy": 0.9041392141189731,
      "output_tokens": 60,
      "latency_sec": 3.528801202774048
    },
    {
      "id": 22,
      "is_correct": false,
      "pred": "A",
      "gold": "C",
      "mean_raw_conf": 0.7014477221996753,
      "last10_raw_conf": 0.944921875,
      "last20_raw_conf": 0.6780517578125,
      "mean_raw_entropy": 1.0034934800940674,
      "output_tokens": 153,
      "latency_sec": 6.242218494415283
    },
    {
      "id": 23,
      "is_correct": false,
      "pred": "D",
      "gold": "B",
      "mean_raw_conf": 0.7802946671195652,
      "last10_raw_conf": 0.90625,
      "last20_raw_conf": 0.9052734375,
      "mean_raw_entropy": 0.7552436748924463,
      "output_tokens": 45,
      "latency_sec": 2.6669065952301025
    },
    {
      "id": 24,
      "is_correct": false,
      "pred": null,
      "gold": "B",
      "mean_raw_conf": 0.7919671474358975,
      "last10_raw_conf": 0.9390625,
      "last20_raw_conf": 0.897265625,
      "mean_raw_entropy": 0.7043175820866202,
      "output_tokens": 116,
      "latency_sec": 5.081538438796997
    },
    {
      "id": 25,
      "is_correct": true,
      "pred": "D",
      "gold": "D",
      "mean_raw_conf": 0.7222249348958333,
      "last10_raw_conf": 0.8806640625,
      "last20_raw_conf": 0.81865234375,
      "mean_raw_entropy": 1.0609989453728,
      "output_tokens": 119,
      "latency_sec": 5.398449420928955
    },
    {
      "id": 26,
      "is_correct": true,
      "pred": "B",
      "gold": "B",
      "mean_raw_conf": 0.6991117931547619,
      "last10_raw_conf": 0.890234375,
      "last20_raw_conf": 0.8388671875,
      "mean_raw_entropy": 1.0657895293264161,
      "output_tokens": 209,
      "latency_sec": 8.305013179779053
    },
    {
      "id": 27,
      "is_correct": false,
      "pred": null,
      "gold": "B",
      "mean_raw_conf": 0.9746065139770508,
      "last10_raw_conf": 1.0,
      "last20_raw_conf": 1.0,
      "mean_raw_entropy": 0.13671500238706358,
      "output_tokens": 1024,
      "latency_sec": 34.37615251541138
    },
    {
      "id": 28,
      "is_correct": true,
      "pred": "C",
      "gold": "C",
      "mean_raw_conf": 0.7869073275862069,
      "last10_raw_conf": 0.938671875,
      "last20_raw_conf": 0.9072265625,
      "mean_raw_entropy": 0.7029222732987898,
      "output_tokens": 57,
      "latency_sec": 3.1638739109039307
    },
    {
      "id": 29,
      "is_correct": true,
      "pred": "B",
      "gold": "B",
      "mean_raw_conf": 0.6950620993589743,
      "last10_raw_conf": 0.83125,
      "last20_raw_conf": 0.702783203125,
      "mean_raw_entropy": 1.0276689246678963,
      "output_tokens": 38,
      "latency_sec": 2.505410671234131
    },
    {
      "id": 30,
      "is_correct": false,
      "pred": null,
      "gold": "A",
      "mean_raw_conf": 0.9414095878601074,
      "last10_raw_conf": 0.999609375,
      "last20_raw_conf": 0.9984375,
      "mean_raw_entropy": 0.24806775428442052,
      "output_tokens": 1011,
      "latency_sec": 34.6945858001709
    },
    {
      "id": 31,
      "is_correct": false,
      "pred": "B",
      "gold": "C",
      "mean_raw_conf": 0.6746929621292372,
      "last10_raw_conf": 0.940625,
      "last20_raw_conf": 0.88349609375,
      "mean_raw_entropy": 1.3805773527187817,
      "output_tokens": 117,
      "latency_sec": 5.185678243637085
    },
    {
      "id": 32,
      "is_correct": false,
      "pred": "D",
      "gold": "B",
      "mean_raw_conf": 0.8025054931640625,
      "last10_raw_conf": 0.908984375,
      "last20_raw_conf": 0.93359375,
      "mean_raw_entropy": 0.6539860449265689,
      "output_tokens": 63,
      "latency_sec": 3.4184091091156006
    },
    {
      "id": 33,
      "is_correct": true,
      "pred": "C",
      "gold": "C",
      "mean_raw_conf": 0.7657124533582089,
      "last10_raw_conf": 0.9111328125,
      "last20_raw_conf": 0.84306640625,
      "mean_raw_entropy": 0.7548082292969547,
      "output_tokens": 65,
      "latency_sec": 3.121208667755127
    },
    {
      "id": 34,
      "is_correct": true,
      "pred": "A",
      "gold": "A",
      "mean_raw_conf": 0.980400562286377,
      "last10_raw_conf": 1.0,
      "last20_raw_conf": 1.0,
      "mean_raw_entropy": 0.1090052871441003,
      "output_tokens": 1024,
      "latency_sec": 35.04292035102844
    },
    {
      "id": 35,
      "is_correct": true,
      "pred": "C",
      "gold": "C",
      "mean_raw_conf": 0.7814577792553191,
      "last10_raw_conf": 0.905859375,
      "last20_raw_conf": 0.8875,
      "mean_raw_entropy": 0.6870941535589543,
      "output_tokens": 93,
      "latency_sec": 4.477187156677246
    },
    {
      "id": 36,
      "is_correct": true,
      "pred": "D",
      "gold": "D",
      "mean_raw_conf": 0.754773591694079,
      "last10_raw_conf": 0.948828125,
      "last20_raw_conf": 0.9625,
      "mean_raw_entropy": 0.865932914085294,
      "output_tokens": 151,
      "latency_sec": 6.471443176269531
    },
    {
      "id": 37,
      "is_correct": false,
      "pred": "B",
      "gold": "C",
      "mean_raw_conf": 0.8882022500038147,
      "last10_raw_conf": 1.0,
      "last20_raw_conf": 1.0,
      "mean_raw_entropy": 0.6451553749502636,
      "output_tokens": 1003,
      "latency_sec": 34.70292139053345
    },
    {
      "id": 38,
      "is_correct": false,
      "pred": null,
      "gold": "B",
      "mean_raw_conf": 0.9630072116851807,
      "last10_raw_conf": 1.0,
      "last20_raw_conf": 1.0,
      "mean_raw_entropy": 0.1795645879174117,
      "output_tokens": 1024,
      "latency_sec": 34.07026481628418
    },
    {
      "id": 39,
      "is_correct": true,
      "pred": "C",
      "gold": "C",
      "mean_raw_conf": 0.8159759004237288,
      "last10_raw_conf": 0.920703125,
      "last20_raw_conf": 0.90869140625,
      "mean_raw_entropy": 0.5799443883410955,
      "output_tokens": 58,
      "latency_sec": 3.4718616008758545
    },
    {
      "id": 40,
      "is_correct": true,
      "pred": "B",
      "gold": "B",
      "mean_raw_conf": 0.6883042279411765,
      "last10_raw_conf": 0.8703125,
      "last20_raw_conf": 0.7962890625,
      "mean_raw_entropy": 1.057234976513713,
      "output_tokens": 49,
      "latency_sec": 3.141676664352417
    },
    {
      "id": 41,
      "is_correct": false,
      "pred": null,
      "gold": "C",
      "mean_raw_conf": 0.803453947368421,
      "last10_raw_conf": 0.922265625,
      "last20_raw_conf": 0.9220703125,
      "mean_raw_entropy": 0.6166482534455625,
      "output_tokens": 74,
      "latency_sec": 3.95695424079895
    },
    {
      "id": 42,
      "is_correct": true,
      "pred": "A",
      "gold": "A",
      "mean_raw_conf": 0.7740017361111111,
      "last10_raw_conf": 0.921484375,
      "last20_raw_conf": 0.8345703125,
      "mean_raw_entropy": 0.800384141670333,
      "output_tokens": 44,
      "latency_sec": 2.838440179824829
    },
    {
      "id": 43,
      "is_correct": true,
      "pred": "B",
      "gold": "B",
      "mean_raw_conf": 0.7696986607142857,
      "last10_raw_conf": 0.923046875,
      "last20_raw_conf": 0.93046875,
      "mean_raw_entropy": 0.816928511432239,
      "output_tokens": 69,
      "latency_sec": 4.778719902038574
    },
    {
      "id": 44,
      "is_correct": false,
      "pred": null,
      "gold": "D",
      "mean_raw_conf": 0.9573838710784912,
      "last10_raw_conf": 1.0,
      "last20_raw_conf": 1.0,
      "mean_raw_entropy": 0.20554294231988024,
      "output_tokens": 1023,
      "latency_sec": 35.35714673995972
    },
    {
      "id": 45,
      "is_correct": false,
      "pred": "B",
      "gold": "D",
      "mean_raw_conf": 0.772887214781746,
      "last10_raw_conf": 0.942578125,
      "last20_raw_conf": 0.872265625,
      "mean_raw_entropy": 0.7775235362350941,
      "output_tokens": 125,
      "latency_sec": 5.499896287918091
    },
    {
      "id": 46,
      "is_correct": true,
      "pred": "A",
      "gold": "A",
      "mean_raw_conf": 0.8041827598314607,
      "last10_raw_conf": 0.94609375,
      "last20_raw_conf": 0.9384765625,
      "mean_raw_entropy": 0.6328951236739587,
      "output_tokens": 88,
      "latency_sec": 4.245189905166626
    },
    {
      "id": 47,
      "is_correct": true,
      "pred": "A",
      "gold": "A",
      "mean_raw_conf": 0.8527390813253012,
      "last10_raw_conf": 0.966796875,
      "last20_raw_conf": 0.9341796875,
      "mean_raw_entropy": 0.5010791620217174,
      "output_tokens": 82,
      "latency_sec": 4.043787956237793
    },
    {
      "id": 48,
      "is_correct": true,
      "pred": "B",
      "gold": "B",
      "mean_raw_conf": 0.7152964610927153,
      "last10_raw_conf": 0.908984375,
      "last20_raw_conf": 0.9021484375,
      "mean_raw_entropy": 1.1793399072246047,
      "output_tokens": 150,
      "latency_sec": 6.25182580947876
    },
    {
      "id": 49,
      "is_correct": true,
      "pred": "C",
      "gold": "C",
      "mean_raw_conf": 0.7759202860169492,
      "last10_raw_conf": 0.91875,
      "last20_raw_conf": 0.87744140625,
      "mean_raw_entropy": 0.7478876630801939,
      "output_tokens": 176,
      "latency_sec": 7.075982332229614
    }
  ]
}

result/vstar_pure_soft_confidence_vs_correctness_report_zh.md

## 2. 关键数值

- 平均原始置信度 `mean_raw_conf`：
  - 正确样本 `0.7581`
  - 错误样本 `0.8056`
- 最后 10 个 token 平均原始置信度 `last10_raw_conf`：
  - 正确样本 `0.9092`
  - 错误样本 `0.9454`
- 最后 20 个 token 平均原始置信度 `last20_raw_conf`：
  - 正确样本 `0.8773`
  - 错误样本 `0.9058`
- 平均原始熵 `mean_raw_entropy`：
  - 正确样本 `0.8487`
  - 错误样本 `0.7238`
- 平均输出长度：
  - 正确样本 `128.7` token
  - 错误样本 `366.7` token
- 平均时延：
  - 正确样本 `5.64s`
  - 错误样本 `13.31s`